[
  {
    "question": "Samatva - Skill in Action",
    "content": "Yoga is perfect skill in action, defined as remaining equally balanced in success and failure, treating both with equanimity.",
    "description": "Two entrepreneurs pitch to investors. One succeeds and becomes overconfident; the other fails and becomes despondent. A third entrepreneur also pitches but whether she wins or loses, she maintains the same steady effort and self-worth. Who practices yoga according to the Gita?",
    "options": [
      "The one who succeeded - success validates skill",
      "The one who failed - failure teaches humility",
      "The one who remains steady regardless of outcome",
      "None of them - yoga is about meditation, not work"
    ],
    "answer": "The one who remains steady regardless of outcome",
    "explanation": "The Gita defines yoga as samatva - equanimity. It is not about winning or losing but about maintaining balance and giving full effort regardless of outcome. The entrepreneur who stays steady practices yoga in action.",
    "difficulty": "easy"
  },
  {
    "question": "Witness Consciousness",
    "content": "The highest state of being is to witness all thoughts, emotions, and events without being identified with them, even while fully engaged in life.",
    "description": "In the middle of a heated family argument, one family member notices the anger rising in their body, observes the words being exchanged, and feels a calm space of awareness beneath the chaos. They respond thoughtfully rather than react impulsively. What state are they accessing?",
    "options": [
      "Emotional detachment that damages relationships",
      "Witness consciousness - observing without being",
      "Suppression of genuine feelings",
      "A freeze trauma response to conflict"
    ],
    "answer": "Witness consciousness - observing without being",
    "explanation": "The Gita's highest teaching is to become the witness (sakshi) of all experiences while remaining fully engaged. This family member accesses the witness state, observing the storm of emotions without being swept away, enabling a wise response.",
    "difficulty": "medium"
  },
  {
    "question": "Surrender to the Divine",
    "content": "Complete surrender to the divine (prapatti) is the ultimate teaching of the Gita - offering all actions and their results to God.",
    "description": "After years of struggling alone with addiction, a person finally admits they cannot control it by sheer willpower and asks for help from a higher power, a community, and professionals. What Gita principle does this reflect?",
    "options": [
      "Giving up personal responsibility for one's actions",
      "The power of surrender - acknowledging limitation",
      "An excuse for lack of willpower",
      "A twelve-step concept foreign to the Gita"
    ],
    "answer": "The power of surrender - acknowledging limitation",
    "explanation": "The Gita's final teaching is sarvadharman parityajya mam ekam sharanam vraja - surrender completely. The person's admission of powerlessness and turning to a higher power reflects this profound spiritual principle of humble surrender.",
    "difficulty": "medium"
  },
  {
    "question": "The Steadfast Devotee",
    "content": "The highest devotee is one who is free from hatred, treats all beings with love, is free from ego, and remains steady in all circumstances.",
    "description": "A community elder is respected by everyone regardless of their background or beliefs. She never speaks ill of anyone, remains calm in crises, and treats critics and supporters with equal warmth. What qualities does she embody?",
    "options": [
      "She is simply a naturally nice person",
      "The qualities of the highest devotee - equal love",
      "She lacks strong opinions and convictions",
      "She is conflict-avoidant to maintain her reputation"
    ],
    "answer": "The qualities of the highest devotee - equal love",
    "explanation": "The Gita describes the highest devotee (and one dearest to Krishna) as one who hates no one, is friendly and compassionate to all, is free from ego and possessiveness, and remains steady in pleasure and pain. The elder exemplifies these qualities.",
    "difficulty": "medium"
  },
  {
    "question": "Living Without 'I' and 'Mine'",
    "content": "Freedom comes from releasing the sense of 'I' (ego as doer) and 'mine' (possessiveness), recognizing everything belongs to the divine.",
    "description": "A successful entrepreneur builds a company, then steps down from leadership and gives significant ownership to employees, feeling the company was never truly 'his' but something that flowed through him. What understanding does this reflect?",
    "options": [
      "Poor business judgment that loses control",
      "Releasing 'I' (ego) and 'mine'",
      "A strategic exit before the company declines",
      "Philanthropic tax planning"
    ],
    "answer": "Releasing 'I' (ego) and 'mine'",
    "explanation": "The Gita teaches liberation from ahamkara (ego) and mamata (mine-ness). The entrepreneur's recognition that the company was not 'his' possession but a manifestation of larger forces reflects this freedom from ownership identity.",
    "difficulty": "medium"
  },
  {
    "question": "The Final Teaching",
    "content": "The Gita's ultimate message is to let go of all lesser dharmas and surrender completely to the divine, finding peace beyond all conceptual frameworks.",
    "description": "A lifelong spiritual seeker has tried many paths - meditation, service, study, devotion - each giving partial peace. Finally, she simply rests in trust, releasing the need to achieve any particular spiritual state. What does this culmination represent?",
    "options": [
      "Spiritual burnout from trying too many approaches",
      "The final teaching - complete surrender beyond",
      "Giving up when progress is not fast enough",
      "Confusion about which path is correct"
    ],
    "answer": "The final teaching - complete surrender beyond",
    "explanation": "After teaching karma yoga, jnana yoga, bhakti yoga, and raja yoga, the Gita culminates in the ultimate teaching: complete and humble surrender to the divine, letting go of all attachment even to spiritual methods and achievements.",
    "difficulty": "hard"
  },
  {
    "question": "Yoga of the Gita - Summary Integration",
    "content": "The entire Bhagavad Gita teaches the integration of selfless action (karma), loving devotion (bhakti), discriminative knowledge (jnana), and mental mastery (raja) into a unified spiritual life.",
    "description": "A person asks how to live spiritually while having a demanding job, family responsibilities, and limited time for formal practice. They want to know one simple takeaway from the Gita. What is the most complete answer?",
    "options": [
      "Meditate for two hours daily and everything will resolve",
      "Perform your duties with full effort, offer them to the divine, remain",
      "Quit your job and become a monk to truly practice spirituality",
      "Just be a good person and it does not matter what teachings you follow"
    ],
    "answer": "Perform your duties with full effort, offer them to the divine, remain",
    "explanation": "The Gita integrates all paths: perform karma yoga (duties with full effort), practice bhakti yoga (offer them to the divine), cultivate samatva (balance in success/failure), and pursue jnana (know your eternal Self). This is the complete teaching for householders.",
    "difficulty": "hard"
  }
]
