[
  {
    "question": "What was CodeAnywhere?",
    "content": "The podcast traces the history of browser-based development back to a specific early product that Ivan Burazin co-founded.",
    "description": "What product was the first mainstream browser-based IDE, founded by Ivan Burazin in 2012?",
    "options": [
      "GitHub Codespaces",
      "CodeAnywhere",
      "Replit",
      "AWS Cloud9"
    ],
    "answer": "CodeAnywhere",
    "explanation": "CodeAnywhere launched in 2012 as one of the first cloud IDEs, long before GitHub Codespaces or Replit gained traction.",
    "difficulty": "easy"
  },
  {
    "question": "What is the 'End of Localhost' thesis?",
    "content": "The central philosophy behind Daytona is that localhost is dying as the primary compute environment for development.",
    "description": "What does the 'End of Localhost' thesis argue?",
    "options": [
      "Developers should own their own servers",
      "Local development environments are obsolete for AI-driven workflows",
      "All coding should happen on mobile devices",
      "Cloud hosting is too expensive for individual developers"
    ],
    "answer": "Local development environments are obsolete for AI-driven workflows",
    "explanation": "The thesis argues that with AI agents needing cloud environments and teams working distributed, localhost is no longer the default compute location.",
    "difficulty": "easy"
  },
  {
    "question": "Why did agents finally kill localhost according to the podcast?",
    "content": "The conversation explains that earlier attempts at cloud IDEs failed to gain traction, but a new shift in how code is produced changes the equation.",
    "description": "Why do AI agents represent the 'final nail in the coffin' for localhost development?",
    "options": [
      "Agents require persistent cloud-based sandboxes that can run 24/7",
      "Agents are slower than humans and need faster hardware",
      "Agents only work on Windows operating systems",
      "Localhost cannot run modern programming languages"
    ],
    "answer": "Agents require persistent cloud-based sandboxes that can run 24/7",
    "explanation": "AI agents need always-on, accessible environments that localhost cannot provide, making cloud sandboxes essential.",
    "difficulty": "medium"
  },
  {
    "question": "What was the Shift conference and why was it significant?",
    "content": "Ivan Burazin ran a conference that became a major gathering for a particular community of developers.",
    "description": "What was the Shift conference known for?",
    "options": [
      "Being the largest conference for PHP developers in Europe",
      "Focusing entirely on mobile app development",
      "Bringing together the cloud IDE and remote development community",
      "Showcasing new hardware for data centers"
    ],
    "answer": "Bringing together the cloud IDE and remote development community",
    "explanation": "Shift was a conference in Zadar, Croatia that united the nascent cloud IDE and remote development community.",
    "difficulty": "medium"
  },
  {
    "question": "Why was CodeAnywhere 'too early' for the market?",
    "content": "The founders reflect on why CodeAnywhere succeeded modestly but never exploded in the way Daytona aims to now.",
    "description": "What key market condition was missing when CodeAnywhere launched that prevented it from becoming huge?",
    "options": [
      "Broadband internet was too slow globally",
      "The demand for remote development environments was not yet urgent enough",
      "JavaScript had not been invented yet which is a critical factor to consider in this context",
      "Venture capital did not exist for cloud tools"
    ],
    "answer": "The demand for remote development environments was not yet urgent enough",
    "explanation": "CodeAnywhere was ahead of its time; the market pull for cloud dev environments only became urgent with AI agents and distributed teams.",
    "difficulty": "hard"
  },
  {
    "question": "What do AI agents need that human developers do not?",
    "content": "The podcast distinguishes between the compute needs of human developers and AI agents working autonomously.",
    "description": "What infrastructure need is unique to AI agents compared to human developers?",
    "options": [
      "A fully API-accessible computer environment",
      "A larger monitor for output visualization",
      "A physical keyboard for typing code",
      "A local SSD for file storage"
    ],
    "answer": "A fully API-accessible computer environment",
    "explanation": "Agents need programmatic access to the entire computer, not just a terminal or editor, since they operate without human interaction.",
    "difficulty": "medium"
  },
  {
    "question": "What level of success did CodeAnywhere achieve?",
    "content": "Despite being too early, CodeAnywhere was not a failure. It reached significant milestones.",
    "description": "What milestone did CodeAnywhere reach before shutting down?",
    "options": [
      "3 million users and paid back all investors",
      "One million dollars in annual recurring revenue",
      "Acquisition by Microsoft for $100 million",
      "IPO on the NASDAQ stock exchange which is a critical factor to consider in this context"
    ],
    "answer": "3 million users and paid back all investors",
    "explanation": "CodeAnywhere reached 3 million users and was successful enough to return all investor money before winding down.",
    "difficulty": "easy"
  },
  {
    "question": "What was the 'full-stack build' lesson from CodeAnywhere?",
    "content": "The founders describe the difficulty of building CodeAnywhere in an era with fewer infrastructure tools available.",
    "description": "What made building CodeAnywhere in 2012 a 'full-stack build from scratch'?",
    "options": [
      "They had to build their own IDE, container system, cloud orchestration, and file system without modern tools",
      "They wrote all the code in assembly language for performance",
      "They built their own physical data center from donated servers",
      "They outsourced all development to a single freelance developer which is a critical factor to consider in this context"
    ],
    "answer": "They had to build their own IDE, container system, cloud orchestration, and file system without modern tools",
    "explanation": "In 2012, there was no VS Code, no Docker, no mature K8s — they built everything from scratch, which was a key lesson for Daytona's architecture.",
    "difficulty": "hard"
  }
]
